<?xml version="1.0" encoding="ISO-8859-1"?>
<?xml-stylesheet type="text/css" href="realm.css"?>
<!DOCTYPE realm SYSTEM "realm.dtd">

<realm>
    <name>Chaos</name>
    <info>
    Chaos reshapes.
    Animates dead matter, burns it again to ashes.
    </info>
	
    <book>
	<name>Laus Eversionis</name>
	<history>
	The Ode to Destruction is one of the most ancient....
	</history>

	<spell>
	    <name>Armageddon</name>
	    <rank>rare</rank>
	    <type> </type>
	    <info> </info>
	    <gfx> </gfx>
	    <upkeep>  40</upkeep>
	    <know>   0</know>
	    <bcost>   0</bcost>
	    <cost>1250</cost>
	</spell>

	<spell>
	    <name>Call The Void</name>
	    <rank>rare</rank>
	    <type> </type>
	    <info> </info>
	    <gfx> </gfx>
	    <upkeep>   0</upkeep>
	    <know>   0</know>
	    <bcost>   0</bcost>
	    <cost> 500</cost>
	</spell>

	<spell>
	    <name>Chaos Surge</name>
	    <rank>rare</rank>
	    <type> </type>
	    <info> </info>
	    <gfx> </gfx>
	    <upkeep>  40</upkeep>
	    <know>   0</know>
	    <bcost>   0</bcost>
	    <cost>1000</cost>
	</spell>

	<spell>
	    <name>Great Drake</name>
	    <rank>rare</rank>
	    <type> </type>
	    <info> </info>
	    <gfx> </gfx>
	    <upkeep>  30</upkeep>
	    <know>   0</know>
	    <bcost>   0</bcost>
	    <cost> 900</cost>
	</spell>

	<spell>
	    <name>Burn</name>
	    <rank>uncommon</rank>
	    <type> </type>
	    <info> </info>
	    <gfx> </gfx>
	    <upkeep>   0</upkeep>
	    <know>   0</know>
	    <bcost>  60</bcost>
	    <cost>   0</cost>
	</spell>

	<spell>
	    <name>Call Chaos</name>
	    <rank>uncommon</rank>
	    <type> </type>
	    <info> </info>
	    <gfx> </gfx>
	    <upkeep>   0</upkeep>
	    <know>   0</know>
	    <bcost>  75</bcost>
	    <cost>   0</cost>
	</spell>

	<spell>
	    <name>Chaos Gates</name>
	    <rank>uncommon</rank>
	    <type> </type>
	    <info> </info>
	    <gfx> </gfx>
	    <upkeep>  15</upkeep>
	    <know>   0</know>
	    <bcost>   0</bcost>
	    <cost>1100</cost>
	</spell>

	<spell>
	    <name>Doom Bolt</name>
	    <rank>uncommon</rank>
	    <type> </type>
	    <info> </info>
	    <gfx> </gfx>
	    <upkeep>   0</upkeep>
	    <know>   0</know>
	    <bcost>  60</bcost>
	    <cost>   0</cost>
	</spell>

	<spell>
	    <name>Disintegrate</name>
	    <rank>uncommon</rank>
	    <type> </type>
	    <info> </info>
	    <gfx> </gfx>
	    <upkeep>   0</upkeep>
	    <know>   0</know>
	    <bcost>  50</bcost>
	    <cost>   0</cost>
	</spell>

	<spell>
	    <name>Fire Storm</name>
	    <rank>uncommon</rank>
	    <type> </type>
	    <info> </info>
	    <gfx> </gfx>
	    <upkeep>   0</upkeep>
	    <know>   0</know>
	    <bcost>   0</bcost>
	    <cost> 250</cost>
	</spell>

	<spell>
	    <name>Flame Strike</name>
	    <rank>uncommon</rank>
	    <type> </type>
	    <info> </info>
	    <gfx> </gfx>
	    <upkeep>   0</upkeep>
	    <know>   0</know>
	    <bcost>  60</bcost>
	    <cost>   0</cost>
	</spell>

	<spell>
	    <name>Great Wasting</name>
	    <rank>uncommon</rank>
	    <type> </type>
	    <info> </info>
	    <gfx> </gfx>
	    <upkeep>   0</upkeep>
	    <know>   0</know>
	    <bcost>  20</bcost>
	    <cost>1000</cost>
	</spell>

	<spell>
	    <name>Hidra</name>
	    <rank>uncommon</rank>
	    <type> </type>
	    <info> </info>
	    <gfx> </gfx>
	    <upkeep>  14</upkeep>
	    <know>   0</know>
	    <bcost>   0</bcost>
	    <cost> 650</cost>
	</spell>

	<spell>
	    <name>Metor Storm</name>
	    <rank>uncommon</rank>
	    <type> </type>
	    <info> </info>
	    <gfx> </gfx>
	    <upkeep>  10</upkeep>
	    <know>   0</know>
	    <bcost>   0</bcost>
	    <cost> 900</cost>
	</spell>

	<spell>
	    <name>Raise Volcano</name>
	    <rank>uncommon</rank>
	    <type> </type>
	    <info> </info>
	    <gfx> </gfx>
	    <upkeep>   0</upkeep>
	    <know>   0</know>
	    <bcost>   0</bcost>
	    <cost> 200</cost>
	</spell>

	<spell>
	    <name>Warp Lightning</name>
	    <rank>uncommon</rank>
	    <type> </type>
	    <info> </info>
	    <gfx> </gfx>
	    <upkeep>   0</upkeep>
	    <know>   0</know>
	    <bcost>  35</bcost>
	    <cost>   0</cost>
	</spell>

	<spell>
	    <name>Beholder</name>
	    <rank>common</rank>
	    <type> </type>
	    <info> </info>
	    <gfx> </gfx>
	    <upkeep>  12</upkeep>
	    <know>   0</know>
	    <bcost>   0</bcost>
	    <cost> 500</cost>
	</spell>

	<spell>
	    <name>Chaos Channels</name>
	    <rank>common</rank>
	    <type> </type>
	    <info> </info>
	    <gfx> </gfx>
	    <upkeep>   0</upkeep>
	    <know>   0</know>
	    <bcost>   0</bcost>
	    <cost>  50</cost>
	</spell>

	<spell>
	    <name>Chaos Rift</name>
	    <rank>common</rank>
	    <type> </type>
	    <info> </info>
	    <gfx> </gfx>
	    <upkeep>  10</upkeep>
	    <know>   0</know>
	    <bcost>   0</bcost>
	    <cost> 300</cost>
	</spell>

	<spell>
	    <name>Cimeras</name>
	    <rank>common</rank>
	    <type> </type>
	    <info> </info>
	    <gfx> </gfx>
	    <upkeep>  10</upkeep>
	    <know>   0</know>
	    <bcost>   0</bcost>
	    <cost> 350</cost>
	</spell>

	<spell>
	    <name>Corruption</name>
	    <rank>common</rank>
	    <type> </type>
	    <info> </info>
	    <gfx> </gfx>
	    <upkeep>   0</upkeep>
	    <know>   0</know>
	    <bcost>   0</bcost>
	    <cost>  40</cost>
	</spell>

	<spell>
	    <name>Distrupt</name>
	    <rank>common</rank>
	    <type> </type>
	    <info> </info>
	    <gfx> </gfx>
	    <upkeep>   0</upkeep>
	    <know>   0</know>
	    <bcost>  15</bcost>
	    <cost>   0</cost>
	</spell>

	<spell>
	    <name>Doom Bat</name>
	    <rank>common</rank>
	    <type> </type>
	    <info> </info>
	    <gfx> </gfx>
	    <upkeep>   8</upkeep>
	    <know>   0</know>
	    <bcost>   0</bcost>
	    <cost> 300</cost>
	</spell>

	<spell>
	    <name>Efreet</name>
	    <rank>common</rank>
	    <type> </type>
	    <info> </info>
	    <gfx> </gfx>
	    <upkeep>  15</upkeep>
	    <know>   0</know>
	    <bcost>   0</bcost>
	    <cost> 550</cost>
	</spell>

	<spell>
	    <name>Eldritch Weapon</name>
	    <rank>common</rank>
	    <type> </type>
	    <info> </info>
	    <gfx> </gfx>
	    <upkeep>   1</upkeep>
	    <know>   0</know>
	    <bcost>  15</bcost>
	    <cost>  75</cost>
	</spell>

	<spell>
	    <name>Flame Blade</name>
	    <rank>common</rank>
	    <type> </type>
	    <info> </info>
	    <gfx> </gfx>
	    <upkeep>   2</upkeep>
	    <know>   0</know>
	    <bcost>  25</bcost>
	    <cost> 125</cost>
	</spell>

	<spell>
	    <name>Fire Ball</name>
	    <rank>common</rank>
	    <type> </type>
	    <info> </info>
	    <gfx> </gfx>
	    <upkeep>   0</upkeep>
	    <know>   0</know>
	    <bcost>  15</bcost>
	    <cost>   0</cost>
	</spell>

	<spell>
	    <name>Fire Bolt</name>
	    <rank>common</rank>
	    <type> </type>
	    <info> </info>
	    <gfx> </gfx>
	    <upkeep>   0</upkeep>
	    <know>   0</know>
	    <bcost>   5</bcost>
	    <cost>   0</cost>
	</spell>

	<spell>
	    <name>Fire Elemental</name>
	    <rank>common</rank>
	    <type> </type>
	    <info> </info>
	    <gfx> </gfx>
	    <upkeep>   0</upkeep>
	    <know>   0</know>
	    <bcost>  20</bcost>
	    <cost>   0</cost>
	</spell>

	<spell>
	    <name>Fire Giant</name>
	    <rank>common</rank>
	    <type> </type>
	    <info> </info>
	    <gfx> </gfx>
	    <upkeep>   3</upkeep>
	    <know>   0</know>
	    <bcost>   0</bcost>
	    <cost> 150</cost>
	</spell>

	<spell>
	    <name>Hell Hounds</name>
	    <rank>common</rank>
	    <type> </type>
	    <info> </info>
	    <gfx> </gfx>
	    <upkeep>   1</upkeep>
	    <know>   0</know>
	    <bcost>   0</bcost>
	    <cost>  40</cost>
	</spell>

	<spell>
	    <name>Immolation</name>
	    <rank>common</rank>
	    <type> </type>
	    <info> </info>
	    <gfx> </gfx>
	    <upkeep>   2</upkeep>
	    <know>   0</know>
	    <bcost>  30</bcost>
	    <cost> 150</cost>
	</spell>

	<spell>
	    <name>Lighting Bolt</name>
	    <rank>common</rank>
	    <type> </type>
	    <info> </info>
	    <gfx> </gfx>
	    <upkeep>   0</upkeep>
	    <know>   0</know>
	    <bcost>  10</bcost>
	    <cost>   0</cost>
	</spell>

	<spell>
	    <name>Magic Vortex</name>
	    <rank>common</rank>
	    <type> </type>
	    <info> </info>
	    <gfx> </gfx>
	    <upkeep>   0</upkeep>
	    <know>   0</know>
	    <bcost>  50</bcost>
	    <cost>   0</cost>
	</spell>

	<spell>
	    <name>Metal Fires</name>
	    <rank>common</rank>
	    <type> </type>
	    <info> </info>
	    <gfx> </gfx>
	    <upkeep>   1</upkeep>
	    <know>   0</know>
	    <bcost>  30</bcost>
	    <cost> 100</cost>
	</spell>

	<spell>
	    <name>Shatter</name>
	    <rank>common</rank>
	    <type> </type>
	    <info> </info>
	    <gfx> </gfx>
	    <upkeep>   0</upkeep>
	    <know>   0</know>
	    <bcost>  12</bcost>
	    <cost>   0</cost>
	</spell>

	<spell>
	    <name>Wall Of Fire</name>
	    <rank>common</rank>
	    <type> </type>
	    <info> </info>
	    <gfx> </gfx>
	    <upkeep>   1</upkeep>
	    <know>   0</know>
	    <bcost>  30</bcost>
	    <cost> 100</cost>
	</spell>

	<spell>
	    <name>Warp Creature</name>
	    <rank>common</rank>
	    <type> </type>
	    <info> </info>
	    <gfx> </gfx>
	    <upkeep>   0</upkeep>
	    <know>   0</know>
	    <bcost>  18</bcost>
	    <cost>   0</cost>
	</spell>

	<spell>
	    <name>Warp Reality</name>
	    <rank>common</rank>
	    <type> </type>
	    <info> </info>
	    <gfx> </gfx>
	    <upkeep>   0</upkeep>
	    <know>   0</know>
	    <bcost>  50</bcost>
	    <cost>   0</cost>
	</spell>

	<spell>
	    <name>Warp Wood</name>
	    <rank>common</rank>
	    <type> </type>
	    <info> </info>
	    <gfx> </gfx>
	    <upkeep>   0</upkeep>
	    <know>   0</know>
	    <bcost>  10</bcost>
	    <cost>   0</cost>
	</spell>

	<spell>
	    <name>Berserk</name>
	    <rank>common</rank>
	    <type> </type>
	    <info> </info>
	    <gfx> </gfx>
	    <upkeep>   0</upkeep>
	    <know>   0</know>
	    <bcost>  30</bcost>
	    <cost>   0</cost>
	</spell>
</book>
</realm>
